{
  "id": "claw_and_tooth_mill",
  "name": "Mill Master",
  "cost": 4,
  "faction": "wilds",
  "card_type": "ship",
  "effects": [
    { "type": "add_combat", "value": 1 },
    { "type": "spawn", "card_id": "claw_and_tooth_mill_base" }
  ],
  "ally_effects": [
    { "type": "add_combat", "value": 1 }
  ],
  "flavor": "From ironwood and bone, the forest forges its teeth.",
  "art_prompt": "beast-folk craftsman summoning weapon mill, medieval fantasy"
}
