{
  "id": "elders_hollow",
  "name": "Elder Summoner",
  "cost": 5,
  "faction": "wilds",
  "card_type": "ship",
  "effects": [
    { "type": "draw_card", "value": 1 },
    { "type": "spawn", "card_id": "elders_hollow_base" }
  ],
  "ally_effects": [
    { "type": "add_authority", "value": 2 }
  ],
  "flavor": "The eldest speaks, and the forest listens.",
  "art_prompt": "ancient druid summoning the elder hollow, wolves gathering, medieval fantasy"
}
