{
  "id": "moss_garden_grove",
  "name": "Moss Weaver",
  "cost": 3,
  "faction": "wilds",
  "card_type": "ship",
  "effects": [
    { "type": "spawn", "card_id": "moss_garden_base" }
  ],
  "ally_effects": [
    { "type": "add_authority", "value": 1 }
  ],
  "flavor": "Moss-coated warriors emerge, armored in living green.",
  "art_prompt": "druid weaving moss armor, serene river garden, medieval fantasy"
}
