{
  "id": "traveling_scholar",
  "name": "Traveling Scholar",
  "cost": 4,
  "faction": "neutral",
  "card_type": "ship",
  "effects": [
    { "type": "add_trade", "value": 2 },
    { "type": "draw_card", "value": 1 }
  ],
  "flavor": "Knowledge flows like water between lands.",
  "art_prompt": "robed scholar with ancient tome and walking staff, forest path, medieval fantasy"
}
